<?xml version="1.0"?>
<!DOCTYPE scene SYSTEM "scene.dtd">
<scene source_fbx="skeleton.fbx">
	<structure>
		<node name="RootNode" path="/RootNode" annotation="None">
			<node name="mixamorig:Hips" path="/RootNode/mixamorig:Hips" annotation="None">
				<node name="mixamorig:RightUpLeg" path="/RootNode/mixamorig:Hips/mixamorig:RightUpLeg" annotation="None">
					<node name="mixamorig:RightLeg" path="/RootNode/mixamorig:Hips/mixamorig:RightUpLeg/mixamorig:RightLeg" annotation="None">
						<node name="mixamorig:RightFoot" path="/RootNode/mixamorig:Hips/mixamorig:RightUpLeg/mixamorig:RightLeg/mixamorig:RightFoot" annotation="None">
							<node name="mixamorig:RightToeBase" path="/RootNode/mixamorig:Hips/mixamorig:RightUpLeg/mixamorig:RightLeg/mixamorig:RightFoot/mixamorig:RightToeBase" annotation="None">
								<node name="mixamorig:RightToe_End" path="/RootNode/mixamorig:Hips/mixamorig:RightUpLeg/mixamorig:RightLeg/mixamorig:RightFoot/mixamorig:RightToeBase/mixamorig:RightToe_End" annotation="None" />
							</node>
						</node>
					</node>
				</node>
				<node name="mixamorig:LeftUpLeg" path="/RootNode/mixamorig:Hips/mixamorig:LeftUpLeg" annotation="None">
					<node name="mixamorig:LeftLeg" path="/RootNode/mixamorig:Hips/mixamorig:LeftUpLeg/mixamorig:LeftLeg" annotation="None">
						<node name="mixamorig:LeftFoot" path="/RootNode/mixamorig:Hips/mixamorig:LeftUpLeg/mixamorig:LeftLeg/mixamorig:LeftFoot" annotation="None">
							<node name="mixamorig:LeftToeBase" path="/RootNode/mixamorig:Hips/mixamorig:LeftUpLeg/mixamorig:LeftLeg/mixamorig:LeftFoot/mixamorig:LeftToeBase" annotation="None">
								<node name="mixamorig:LeftToe_End" path="/RootNode/mixamorig:Hips/mixamorig:LeftUpLeg/mixamorig:LeftLeg/mixamorig:LeftFoot/mixamorig:LeftToeBase/mixamorig:LeftToe_End" annotation="None" />
							</node>
						</node>
					</node>
				</node>
				<node name="mixamorig:Spine" path="/RootNode/mixamorig:Hips/mixamorig:Spine" annotation="None">
					<node name="mixamorig:Spine1" path="/RootNode/mixamorig:Hips/mixamorig:Spine/mixamorig:Spine1" annotation="None">
						<node name="mixamorig:Spine2" path="/RootNode/mixamorig:Hips/mixamorig:Spine/mixamorig:Spine1/mixamorig:Spine2" annotation="None">
							<node name="mixamorig:RightShoulder" path="/RootNode/mixamorig:Hips/mixamorig:Spine/mixamorig:Spine1/mixamorig:Spine2/mixamorig:RightShoulder" annotation="None">
								<node name="mixamorig:RightArm" path="/RootNode/mixamorig:Hips/mixamorig:Spine/mixamorig:Spine1/mixamorig:Spine2/mixamorig:RightShoulder/mixamorig:RightArm" annotation="None">
									<node name="mixamorig:RightForeArm" path="/RootNode/mixamorig:Hips/mixamorig:Spine/mixamorig:Spine1/mixamorig:Spine2/mixamorig:RightShoulder/mixamorig:RightArm/mixamorig:RightForeArm" annotation="None">
										<node name="mixamorig:RightHand" path="/RootNode/mixamorig:Hips/mixamorig:Spine/mixamorig:Spine1/mixamorig:Spine2/mixamorig:RightShoulder/mixamorig:RightArm/mixamorig:RightForeArm/mixamorig:RightHand" annotation="None">
											<node name="mixamorig:RightHandIndex1" path="/RootNode/mixamorig:Hips/mixamorig:Spine/mixamorig:Spine1/mixamorig:Spine2/mixamorig:RightShoulder/mixamorig:RightArm/mixamorig:RightForeArm/mixamorig:RightHand/mixamorig:RightHandIndex1" annotation="None">
												<node name="mixamorig:RightHandIndex2" path="/RootNode/mixamorig:Hips/mixamorig:Spine/mixamorig:Spine1/mixamorig:Spine2/mixamorig:RightShoulder/mixamorig:RightArm/mixamorig:RightForeArm/mixamorig:RightHand/mixamorig:RightHandIndex1/mixamorig:RightHandIndex2" annotation="None">
													<node name="mixamorig:RightHandIndex3" path="/RootNode/mixamorig:Hips/mixamorig:Spine/mixamorig:Spine1/mixamorig:Spine2/mixamorig:RightShoulder/mixamorig:RightArm/mixamorig:RightForeArm/mixamorig:RightHand/mixamorig:RightHandIndex1/mixamorig:RightHandIndex2/mixamorig:RightHandIndex3" annotation="None">
														<node name="mixamorig:RightHandIndex4" path="/RootNode/mixamorig:Hips/mixamorig:Spine/mixamorig:Spine1/mixamorig:Spine2/mixamorig:RightShoulder/mixamorig:RightArm/mixamorig:RightForeArm/mixamorig:RightHand/mixamorig:RightHandIndex1/mixamorig:RightHandIndex2/mixamorig:RightHandIndex3/mixamorig:RightHandIndex4" annotation="None" />
													</node>
												</node>
											</node>
										</node>
									</node>
								</node>
							</node>
							<node name="mixamorig:LeftShoulder" path="/RootNode/mixamorig:Hips/mixamorig:Spine/mixamorig:Spine1/mixamorig:Spine2/mixamorig:LeftShoulder" annotation="None">
								<node name="mixamorig:LeftArm" path="/RootNode/mixamorig:Hips/mixamorig:Spine/mixamorig:Spine1/mixamorig:Spine2/mixamorig:LeftShoulder/mixamorig:LeftArm" annotation="None">
									<node name="mixamorig:LeftForeArm" path="/RootNode/mixamorig:Hips/mixamorig:Spine/mixamorig:Spine1/mixamorig:Spine2/mixamorig:LeftShoulder/mixamorig:LeftArm/mixamorig:LeftForeArm" annotation="None">
										<node name="mixamorig:LeftHand" path="/RootNode/mixamorig:Hips/mixamorig:Spine/mixamorig:Spine1/mixamorig:Spine2/mixamorig:LeftShoulder/mixamorig:LeftArm/mixamorig:LeftForeArm/mixamorig:LeftHand" annotation="None">
											<node name="mixamorig:LeftHandIndex1" path="/RootNode/mixamorig:Hips/mixamorig:Spine/mixamorig:Spine1/mixamorig:Spine2/mixamorig:LeftShoulder/mixamorig:LeftArm/mixamorig:LeftForeArm/mixamorig:LeftHand/mixamorig:LeftHandIndex1" annotation="None">
												<node name="mixamorig:LeftHandIndex2" path="/RootNode/mixamorig:Hips/mixamorig:Spine/mixamorig:Spine1/mixamorig:Spine2/mixamorig:LeftShoulder/mixamorig:LeftArm/mixamorig:LeftForeArm/mixamorig:LeftHand/mixamorig:LeftHandIndex1/mixamorig:LeftHandIndex2" annotation="None">
													<node name="mixamorig:LeftHandIndex3" path="/RootNode/mixamorig:Hips/mixamorig:Spine/mixamorig:Spine1/mixamorig:Spine2/mixamorig:LeftShoulder/mixamorig:LeftArm/mixamorig:LeftForeArm/mixamorig:LeftHand/mixamorig:LeftHandIndex1/mixamorig:LeftHandIndex2/mixamorig:LeftHandIndex3" annotation="None">
														<node name="mixamorig:LeftHandIndex4" path="/RootNode/mixamorig:Hips/mixamorig:Spine/mixamorig:Spine1/mixamorig:Spine2/mixamorig:LeftShoulder/mixamorig:LeftArm/mixamorig:LeftForeArm/mixamorig:LeftHand/mixamorig:LeftHandIndex1/mixamorig:LeftHandIndex2/mixamorig:LeftHandIndex3/mixamorig:LeftHandIndex4" annotation="None" />
													</node>
												</node>
											</node>
										</node>
									</node>
								</node>
							</node>
							<node name="mixamorig:Neck" path="/RootNode/mixamorig:Hips/mixamorig:Spine/mixamorig:Spine1/mixamorig:Spine2/mixamorig:Neck" annotation="None">
								<node name="mixamorig:Head" path="/RootNode/mixamorig:Hips/mixamorig:Spine/mixamorig:Spine1/mixamorig:Spine2/mixamorig:Neck/mixamorig:Head" annotation="None">
									<node name="mixamorig:HeadTop_End" path="/RootNode/mixamorig:Hips/mixamorig:Spine/mixamorig:Spine1/mixamorig:Spine2/mixamorig:Neck/mixamorig:Head/mixamorig:HeadTop_End" annotation="None" />
								</node>
							</node>
						</node>
					</node>
				</node>
			</node>
			<node name="sub02" path="/RootNode/sub02" annotation="None" />
			<node name="sub01" path="/RootNode/sub01" annotation="None" />
		</node>
	</structure>
</scene>
